{
  "schema_version": "0.3.0",
  "generated_at": "2026-07-15T00:00:00Z",
  "system": {
    "os": "macos",
    "os_version": "15.5",
    "os_build": "24F74",
    "architecture": "arm64",
    "process_architecture": "arm64",
    "translation_state": "native",
    "shell": {
      "login_path": "/bin/zsh",
      "login_name": "zsh",
      "invoking_path": "/bin/zsh",
      "invoking_name": "zsh"
    },
    "path_entries": [
      {
        "position": 0,
        "value": "/opt/homebrew/bin",
        "state": "exists",
        "duplicate": false
      }
    ],
    "sources": [
      {
        "kind": "fixture",
        "name": "deterministic golden fixture",
        "collected_at": "2026-07-15T00:00:00Z",
        "confidence": "high"
      }
    ]
  },
  "tools": [
    {
      "id": "runtime.node",
      "display_name": "Node.js",
      "category": "runtime",
      "installations": [
        {
          "id": "node-homebrew-24",
          "version": "v24.4.0",
          "normalized_version": "24.4.0",
          "path": "/opt/homebrew/bin/node",
          "architecture": "arm64",
          "manager": "homebrew",
          "active_state": "active",
          "default_state": "default",
          "install_reason": "direct",
          "sources": [
            {
              "kind": "fixture",
              "name": "deterministic golden fixture",
              "collected_at": "2026-07-15T00:00:00Z",
              "confidence": "high"
            }
          ]
        }
      ]
    }
  ],
  "findings": []
}
