{
  "schema_version": "0.3.0",
  "generated_at": "2026-07-15T00:00:00Z",
  "system": {
    "os": "macos",
    "os_version": "15.5",
    "os_build": "24F74",
    "architecture": "arm64",
    "process_architecture": "arm64",
    "translation_state": "native",
    "shell": {
      "login_path": "/bin/zsh",
      "login_name": "zsh",
      "invoking_path": "/bin/zsh",
      "invoking_name": "zsh"
    },
    "path_entries": [
      {
        "position": 0,
        "value": "/opt/homebrew/bin",
        "state": "exists",
        "duplicate": false
      },
      {
        "position": 1,
        "value": "/usr/bin",
        "state": "exists",
        "duplicate": false
      }
    ],
    "sources": [
      {
        "kind": "fixture",
        "name": "I02 public example",
        "collected_at": "2026-07-15T00:00:00Z",
        "confidence": "high"
      }
    ]
  },
  "tools": [
    {
      "id": "runtime.node",
      "display_name": "Node.js",
      "category": "runtime",
      "installations": [
        {
          "id": "node-nvm-22",
          "version": "v22.17.0",
          "normalized_version": "22.17.0",
          "path": "/Users/example/.nvm/versions/node/v22.17.0/bin/node",
          "architecture": "arm64",
          "manager": "nvm",
          "active_state": "inactive",
          "default_state": "non_default",
          "install_reason": "direct",
          "sources": [
            {
              "kind": "fixture",
              "name": "I02 public example",
              "collected_at": "2026-07-15T00:00:00Z",
              "confidence": "high"
            }
          ]
        },
        {
          "id": "node-homebrew-24",
          "version": "v24.4.0",
          "normalized_version": "24.4.0",
          "path": "/opt/homebrew/bin/node",
          "architecture": "arm64",
          "manager": "homebrew",
          "active_state": "active",
          "default_state": "default",
          "install_reason": "direct",
          "sources": [
            {
              "kind": "fixture",
              "name": "I02 public example",
              "collected_at": "2026-07-15T00:00:00Z",
              "confidence": "high"
            }
          ]
        }
      ]
    }
  ],
  "findings": [
    {
      "id": "finding-node-multiple",
      "code": "MULTIPLE_INSTALLATIONS",
      "severity": "warning",
      "status": "conflict",
      "message": "Node.js has multiple known installations.",
      "evidence": [
        "node-nvm-22",
        "node-homebrew-24"
      ],
      "confidence": "high",
      "recommendation": "Review the intended active and default installation before changing Node.js.",
      "impact": [
        "Changing the default may affect projects and shells."
      ],
      "tool_id": "runtime.node",
      "sources": [
        {
          "kind": "fixture",
          "name": "I02 public example",
          "collected_at": "2026-07-15T00:00:00Z",
          "confidence": "high"
        }
      ]
    }
  ]
}
